{
  "$schema": "https://json-schema.org/draft/2020-12/schema",
  "$id": "https://example.invalid/uqe/evidence.schema.json",
  "title": "UQE Evidence Report",
  "description": "Machine-checkable output contract for UQE verification. Every completion claim must be backed by a report validating against this schema: named artifacts, observed results, defects, and scores. No evidence object without a real artifact at 'path' that the agent actually inspected.",
  "type": "object",
  "required": ["task", "tier", "evidence"],
  "additionalProperties": false,
  "properties": {
    "task": {
      "type": "string",
      "minLength": 1,
      "description": "One-line description of what was done."
    },
    "tier": {
      "type": "string",
      "enum": ["T0", "T1", "T2", "T3"],
      "description": "Effort tier selected per SKILL.md Section 2."
    },
    "generated_at": {
      "type": "string",
      "format": "date-time",
      "description": "ISO-8601 timestamp of report creation (optional but recommended)."
    },
    "evidence": {
      "type": "array",
      "minItems": 1,
      "description": "Named, inspectable artifacts. Empty array is invalid: no evidence means no completion claim.",
      "items": {
        "type": "object",
        "required": ["type", "path", "observed"],
        "additionalProperties": false,
        "properties": {
          "type": {
            "type": "string",
            "enum": [
              "screenshot", "frame", "render", "test_output", "command_output",
              "diff", "citation", "measurement", "audit_log", "quote", "other"
            ]
          },
          "path": {
            "type": "string",
            "minLength": 1,
            "description": "Workspace-relative path to the artifact file, or a canonical identifier (e.g. commit hash, URL) for non-file evidence."
          },
          "observed": {
            "type": "string",
            "minLength": 10,
            "description": "What the agent actually saw when inspecting the artifact. Must be a concrete observation, not a restatement of intent. 'SEEN standard': if you did not open it, you may not write it here."
          },
          "quality": {
            "type": "string",
            "enum": ["E3", "E2", "E1"],
            "description": "Evidence level per modules/evidence.md: E3 direct observation, E2 derived proxy, E1 asserted only."
          },
          "tool": {
            "type": "string",
            "description": "Producer of the artifact, e.g. 'playwright', 'ffmpeg', 'pytest', 'curl'."
          }
        }
      }
    },
    "defects": {
      "type": "array",
      "description": "Findings from self-critique or verification. Omitted or empty means none found — which is itself a claim requiring evidence.",
      "items": {
        "type": "object",
        "required": ["severity", "description"],
        "additionalProperties": false,
        "properties": {
          "severity": { "type": "string", "enum": ["critical", "major", "minor"] },
          "description": { "type": "string", "minLength": 5 },
          "status": { "type": "string", "enum": ["open", "fixed", "wontfix"], "default": "open" },
          "evidence_refs": {
            "type": "array",
            "items": { "type": "string" },
            "description": "Paths/ids of evidence items that show this defect."
          }
        }
      }
    },
    "scores": {
      "type": "object",
      "description": "1-10 quality metric scores. Any score key allowed; values must be integers 1-10.",
      "minProperties": 1,
      "additionalProperties": { "type": "integer", "minimum": 1, "maximum": 10 }
    },
    "unverified_claims": {
      "type": "array",
      "items": {
        "type": "object",
        "required": ["claim", "reason"],
        "additionalProperties": false,
        "properties": {
          "claim": { "type": "string", "minLength": 3 },
          "reason": { "type": "string", "minLength": 3 },
          "manual_check": { "type": "string", "description": "Exact command the user can run to close the gap." }
        }
      },
      "description": "Honest disclosure list: claims made without sufficient evidence, why, and how the user can verify."
    }
  }
}
